[
  {
    "id": "synthetic-exact-section-001",
    "question": "What duty is stated in section 14(2)?",
    "query_type": "EXACT_REFERENCE",
    "expected_document_ids": ["synthetic-act-a"],
    "expected_sections": ["14(2)"],
    "expected_clauses": [],
    "gold_evidence": [{ "id": "synthetic-act-a:chunk-1", "documentId": "synthetic-act-a", "chunkId": "chunk-1", "section": "14(2)", "text": "The Authority shall publish an annual report." }],
    "answerable": true,
    "expected_authority_class": "PRIMARY_OFFICIAL",
    "difficulty": "easy",
    "jurisdiction": "India",
    "document_type": "act",
    "notes": "Synthetic evaluator regression case; not legal ground truth.",
    "review_status": "AUTO_GENERATED_DRAFT"
  },
  {
    "id": "synthetic-multiple-documents-002",
    "question": "Compare the registration duties in the two synthetic rules.",
    "query_type": "COMPARISON",
    "expected_document_ids": ["synthetic-rule-a", "synthetic-rule-b"],
    "expected_sections": ["4", "8"],
    "expected_clauses": [],
    "gold_evidence": [
      { "id": "synthetic-rule-a:chunk-1", "documentId": "synthetic-rule-a", "chunkId": "chunk-1", "section": "4", "text": "A producer shall register." },
      { "id": "synthetic-rule-b:chunk-2", "documentId": "synthetic-rule-b", "chunkId": "chunk-2", "section": "8", "text": "A recycler shall obtain authorization." }
    ],
    "answerable": true,
    "expected_authority_class": "PRIMARY_OFFICIAL",
    "difficulty": "medium",
    "jurisdiction": "India",
    "document_type": "rule",
    "notes": "Synthetic multi-answer evaluator case; not legal ground truth.",
    "review_status": "AUTO_GENERATED_DRAFT"
  },
  {
    "id": "synthetic-unanswerable-003",
    "question": "What is the deadline in the nonexistent Synthetic Quantum Rule 2099?",
    "query_type": "FACTUAL",
    "expected_document_ids": [],
    "expected_sections": [],
    "expected_clauses": [],
    "gold_evidence": [],
    "answerable": false,
    "expected_authority_class": "UNKNOWN",
    "difficulty": "easy",
    "jurisdiction": "India",
    "document_type": "rule",
    "notes": "Synthetic negative control; correct behavior is abstention.",
    "review_status": "AUTO_GENERATED_DRAFT"
  },
  {
    "id": "synthetic-clause-ranking-004",
    "question": "Which clause creates the synthetic filing penalty?",
    "query_type": "EXACT_REFERENCE",
    "expected_document_ids": ["synthetic-regulation-c"],
    "expected_sections": ["9"],
    "expected_clauses": ["9(3)"],
    "gold_evidence": [{ "id": "synthetic-regulation-c:chunk-3", "documentId": "synthetic-regulation-c", "chunkId": "chunk-3", "section": "9", "clause": "9(3)", "text": "Clause 9(3) states the filing penalty." }],
    "answerable": true,
    "expected_authority_class": "PRIMARY_OFFICIAL",
    "difficulty": "hard",
    "jurisdiction": "Gujarat",
    "document_type": "regulation",
    "notes": "Synthetic chunk-ranking case; not legal ground truth.",
    "review_status": "AUTO_GENERATED_DRAFT"
  },
  {
    "id": "synthetic-authority-ranking-005",
    "question": "Which synthetic authority issued the circular?",
    "query_type": "METADATA",
    "expected_document_ids": ["synthetic-circular-d"],
    "expected_sections": [],
    "expected_clauses": [],
    "gold_evidence": [{ "id": "synthetic-circular-d:metadata", "documentId": "synthetic-circular-d", "chunkId": "metadata", "text": "Authority: Synthetic Board" }],
    "answerable": true,
    "expected_authority_class": "OFFICIAL_SECONDARY",
    "difficulty": "medium",
    "jurisdiction": "Odisha",
    "document_type": "circular",
    "notes": "Synthetic authority-ranking case; not legal ground truth.",
    "review_status": "AUTO_GENERATED_DRAFT"
  }
]
